Title,Abstract,NCT ID
A Randomized Phase I Safety and Immunogenicity Trial of Live Recombinant Canarypox ALVAC HIV vCP205 Delivered by Alternate Mucosal Routes in HIV 1 Uninfected Adult Volunteers,To compare the safety of ALVAC HIV vCP205 to that of ALVAC RG vCP65 rabies glycoprotein delivered by a variety of mucosal routes  To evaluate the antibody  humoral  and cellular  immune responses resulting from ALVAC HIV vCP205   AS PER AMENDMENT 8 3 98  To obtain safety       data on AIDSVAX B B boosting administered by the intramuscular and intranasal routes in the       context of previous immunization via alternate mucosal routes or intramuscularly with a       canarypox vector expressing HIV 1 antigens  vCP205   To obtain immunogenicity data on       AIDSVAX B B boosting   One of the earliest observations in the HIV epidemic was the       demonstration of HIV infection at mucosal surfaces of cells in the genital tract  These data       suggest that priming of immune defenses of viral infected cells may be an important       component in the strategy of developing an effective HIV vaccine  Direct immunization of       relevant mucosal surfaces with a vectored vaccine may stimulate mucosal immunity  The       ALVAC HIV vCP205 immunogen is constructed from a live recombinant canarypox vector that has       a good safety profile in volunteers and should allow mucosal induction of immunity,NCT00000884
A Phase II Trial of Leuprolide   Flutamide   Suramin in Untreated Poor Prognosis Prostate Carcinoma,One current hypothesis as to what limits duration of initial hormone response is the rapid       emergence of hormone resistant prostate carcinoma cells  Suramin has shown effectiveness as       a treatment for hormonally refractory prostate carcinoma  Survival was less in patients with       high rather than low circulating androgen levels  Thus  suramin might slow the emergence of       hormone refractory tumor cells while combined androgen ablation may maximize the       effectiveness of suramin  In this trial  we will pilot this concept,NCT00001266
A Phase I Study of Continuous Infusion Immunotoxin IgG RFB4 SMPT dgA in Refractory CD22 Positive B Cell Lymphoma,Patients with CD22    B cell lymphomas will be treated with escalating doses as a 192 hr       infusion of immunotoxin in a Phase I study to determine dose limiting toxicity evidence of       response,NCT00001271
Familial Prostate Cancer,The purpose of this study is to identify affected individuals in families with prostate       cancer and to use this information to identify genetic markers closely linked to the disease       gene,NCT00001377
A Phase I Study of Recombinant Vaccinia Virus That Expresses Prostate Specific Antigen in Adult Patients With Adenocarcinoma of the Prostate,This trial will evaluate  in patients with metastatic prostate cancer  the tolerability        toxicities  efficacy  and immunologic effects of repeated vaccinations with a recombinant       vaccinia virus that contains the Prostate Specific Antigen gene  PROSTVAC,NCT00001382
A Phase I Study of Infusional Paclitaxel With the P Glycoprotein Antagonist PSC 833,This is a dosage escalation study to estimate the maximum tolerated dose of drug resistance       inhibitor PSC 833 given in combination with paclitaxel  Groups of 3 to 6 patients receive       continuous infusion paclitaxel for 5 days and oral PSC 833 for 6 7 days  following       paclitaxel on the first course  then beginning 3 days prior to paclitaxel on subsequent       courses         Stable and responding patients are re treated every 21 days  with paclitaxel dose adjusted       to maintain an absolute neutrophil count less than 500 for no more than 4 days,NCT00001383
A Randomized Phase II Study of Oral Thalidomide in Patients With Hormone Refractory Prostate Cancer,This is a phase II study designed to evaluate the potential clinical efficacy of thalidomide       in patients with hormone refractory prostate cancer         An important aspect of this study is to characterize the pharmacokinetics of thalidomide  as       well as make correlations between the degree of angiogenesis occurring in a patient and the       activity of thalidomide,NCT00001446
Phase II Trial of a 96 Hour Continuous Infusion of Paclitaxel Followed by Cisplatin for Patients With Stage III IV and Relapsed NSCLC,This is a Phase II study of paclitaxel  Taxol R  administered as a 96 hour  4 day        continuous infusion followed by a bolus of cisplatin for previously untreated patients with       stage III IV or relapsed non small cell lung cancer  NSCLC   The goal of this phase II study       is to determine the response rate of this infusional paclitaxel and bolus cisplatin regimen       in patients with advanced NSCLC,NCT00001450
Phase II Neoadjuvant Trial of a Continuous Infusion of Paclitaxel Plus Cisplatin Followed by Chest Radiotherapy for Patients With Stage III Non Small Cell Lung Cancer,2 Drug Combination Chemotherapy Followed by Radiotherapy  Paclitaxel  TAX  NSC 125973        Cisplatin  CDDP  NSC 119875  followed by chest irradiation using 4 15 MV photons,NCT00001499
A Phase II Trial of All Trans Retinoic Acid in Combination With Interferon Alpha 2a in Children With Recurrent Neuroblastoma or Wilms  Tumor,A body of preclinical data has provided a strong rationale for evaluating the combination of       IFN alpha with retinoic acid  The two drugs have different mechanisms of action and  when       used in combination  show enhanced activity in both adult and pediatric tumor cell lines         The combination of the antiproliferative and differentiation inducing effect of retinoids       together with the antiproliferative  immunostimulatory and differentiation potentiating       effects of IFN alpha warrant clinical investigation of this combination for the treatment of       refractory pediatric malignancies,NCT00001509
Phase I II Multiple Dose Safety and Efficacy Study of a Selective Inhibitor of Cyclooxygenase   2  SC 58635  in Hereditary Non Polyposis Colorectal Cancer  HNPCC  Patients and Carriers,This is a randomized  placebo controlled Phase I II multi center trial  of the safety and       efficacy of Celecoxib in a cohort of 81 HNPCC subjects and gene carriers  The three proposed       intervention arms are  Celecoxib  to be provided by Searle  will be administered at 200mg       p o  BID x 12 months or 400mg p o  BID x 12 months vs  Placebo p o  BID x 12 months        Assessment of endoscopic and tissue based biomarker endpoints will be conducted at baseline       and 12 months on study drug or placebo  Patients that present with polyps at baseline will       undergo a month 4 endoscopy  Plasma drug trough samples for pharmacokinetic analyses will be       collected at baseline and month 12  NCI Chemoprevention Branch will coordinate the efforts       and activities of all sites         Safety monitoring will occur via in patient interviews with exams at month twelve  symptom       questionnaires completed at baseline  months one  four  eight and twelve  blood and       urinalysis at baseline and at months one  four  eight and twelve  A post administration       telephone call to evaluate side effect resolution will occur at months 13 14 for patients       who have unresolved adverse events at the end of month 12,NCT00001693
A Pharmacokinetic Study of Genistein  a Tyrosine Kinase Inhibitor,Genistein is a natural product found in soy beans  its consumption has been associated with       a low incidence of metastatic prostate cancer  Genistein is a known protein tyrosine kinase       inhibitor  and in preclinical studies it has been shown to increase cell adhesion  Increases       in cell adhesion in vivo would phenotypically reverse the first step in the metastatic       cascade  potentially preventing metastasis formation  and is consistent with epidemiologic       findings  This study seeks to determine the pharmacokinetics of genistein in humans by       administering a single dose of genistein and performing a pharmacokinetic analysis  Patients       will be treated with two formulations of genistein  a 43  genistein preparation or a 90        preparation   This is a phase I study  and patients will be treated on one of three dosing       levels  Patients will be randomly assigned to receive one formulation first  followed by a       washout period  and will then receive the second preparation  i e  a randomized cross over       design   Information from this study will be used to optimally design a multiple dose study       wherein patients will be treated for longer periods of time,NCT00001696
Vaccine Therapy With Tumor Specific Mutated VHL Peptides in Adult Cancer Patients With Renal Cell Carcinoma,About 27 000 new cases of renal cell carcinoma  RCC  are diagnosed every year in the United       States  11 000 of these cases will die from the disease  More than half of patients present       with advanced or metastatic disease for which chemotherapy plays a very limited role        Therefore  development of another therapeutic approach is needed  Cancers in humans are       commonly associated with mutations in dominant and recessive oncogenes  These genes produce       mutated proteins that are unique to cancer cells  Von Hipple Lindau  VHL  gene which is       associated with the development of the VHL disease  has been recently mapped and cloned  and       it is found to be mutated in 57  of sporadic renal cell carcinomas         Data in mice have shown the generation of major histocompatibility complex  MHC  restricted       cytotoxic T lymphocyte  CTL  that are capable of detecting endogenous cytoplasmic peptide       derived from mutated oncogenes  In addition  we have recently demonstrated  by conducting       different phase I clinical trials in which we vaccinate cancer patients with mutated Ras or       p53 peptides corresponding to the abnormality patients harbor in their tumors  that in some       patients we can generate immunological responses represented by the generation of       lymphocytes  CD4  and or CD8    In the current study  we would like to extend our       observations to test whether VHL tumor suppressor protein can be immunologically targeted by       vaccination  We have identified specific epitopes along the amino acid sequence of the VHL       protein  which represent known specific human leukocyte antigen  HLA  class I binding       motifs  These amino acids stretches in the VHL protein correspond to the area of the point       mutation hot spots  Therefore  we propose to treat patients with sporadic RCC who carry VHL       mutations in their tumors with corresponding mutant VHL peptide vaccination  This       vaccination will be done either by using pulsed autologous peripheral mononuclear cells with       the peptides  or peptides administered subcutaneously alone or in combination with       cytokines,NCT00001703
p53 Vaccine for Ovarian Cancer,This study will examine whether vaccination with a p53 peptide can boost an immune response       to ovarian cancer and what the side effects are of the vaccine         Many patients with ovarian cancer have an altered  mutated  gene called p53 that causes the       production of abnormal proteins found in their tumor cells  The body s immune system may       try  unsuccessfully  to fight these abnormal proteins  In this study  ovarian cancer       patients with a p53 abnormality will be vaccinated with a p53 peptide a part of the same       abnormal protein found in their tumor to try to boost their body s immune response to the       cancer         Patients will be divided into two groups  Group A will have four p53 peptide vaccinations       three weeks apart  injected under the skin  The injection will include a drug called ISA 51        which increases the effect of the vaccine  This group will also receive two other drugs that       boost the immune system  IL 2 and GM CSF  Group B will have four p53 peptide vaccinations       three weeks apart  The peptide will be mixed with the patient s own blood cells and infused       into a vein  This group will also receive IL 2  but not GM CSF         All study candidates will be tested to see if their cancer has a p53 abnormality and if       their immune system mounted a defense against it  These tests may include a tumor biopsy        removal of a small part of the tumor for microscopic examination   lymphapheresis  a       procedure to take blood  remove white blood cells called lymphocytes  and return the red       cells   and an immune response test similar to a skin test for tuberculosis  During the       study  patients will have additional skin tests and blood tests,NCT00001827
Monoclonal Antibody Therapy in Treating Children With Metastatic Neuroblastoma in Second Remission,RATIONALE  Monoclonal antibodies can locate tumor cells and either kill them or deliver       tumor killing substances to them without harming normal cells         PURPOSE  Phase II trial to study the effectiveness of monoclonal antibody in treating       children with metastatic neuroblastoma in second remission,NCT00002458
Radiation Therapy in Treating Patients With Prostate Cancer,RATIONALE  Radiation therapy uses high energy x rays to damage tumor cells  Radiation       therapy may be an effective treatment for prostate cancer         PURPOSE  Phase I trial to study the effectiveness of radiation therapy in treating patients       who have stage II or stage III prostate cancer,NCT00002480
Radiation Therapy Using 3 Dimensional Treatment Planning in Patients With Non small Cell Lung Cancer,RATIONALE  Radiation therapy uses high energy x rays to damage tumor cells  Computer systems       that allow doctors to create a 3 dimensional picture of the tumor in order to plan treatment       may result in more effective radiation therapy         PURPOSE  Phase I trial to study the effectiveness of high dose radiation therapy planned       using a 3 dimensional picture of the tumor in treating patients who have stage I  stage II        or stage III non small cell lung cancer,NCT00002484
Strontium Compared With Radiation Therapy in Treating Patients With Hormone Refractory Prostate Cancer With Painful Bone Metastases,RATIONALE  Radiolabeled monoclonal antibodies can locate tumor cells and either kill them or       deliver tumor killing substances to them without harming normal cells  This may be an       effective treatment for prostate cancer         PURPOSE  Randomized phase III trial to compare the effectiveness of strontium or radiation       therapy in treating patients with prostate cancer that is refractory to hormone therapy who       have painful bone metastases,NCT00002503
Radiation Therapy Compared With No Further Treatment Following Surgery in Treating Patients With Prostate Cancer,RATIONALE  Radiation therapy uses high energy x rays to damage tumor cells and may be an       effective treatment for prostate cancer         PURPOSE  Randomized phase III trial to compare radiation therapy with no further treatment       in treating patients with stage III prostate cancer following radical prostatectomy,NCT00002511
Paclitaxel Plus Radiation Therapy in Treating Patients With Untreated Stage III Non small Cell Lung Cancer,RATIONALE  Drugs used in chemotherapy use different ways to stop tumor cells from dividing       so they stop growing or die  Combining radiation therapy with chemotherapy may kill more       tumor cells         PURPOSE  Phase I trial to study the effectiveness of chemotherapy with paclitaxel in       combination with radiation therapy to the chest in patients with previously untreated stage       III non small cell lung cancer that cannot be surgically removed,NCT00002519
Hormone Therapy and Chemotherapy in Treating Perimenopausal or Postmenopausal Women With Node Positive Breast Cancer,RATIONALE  Estrogen can stimulate the growth of breast cancer cells  Hormone therapy may       fight breast cancer by blocking the uptake of estrogen  Drugs used in chemotherapy use       different ways to stop tumor cells from dividing so they stop growing or die  Combining       chemotherapy with hormone therapy may kill more tumor cells  It is not yet known which       treatment regimen is more effective for breast cancer         PURPOSE  Randomized phase III trial to compare the effectiveness of hormone therapy during       or after combination chemotherapy or hormone therapy alone in treating perimenopausal or       postmenopausal women who have stage II or stage IIIA breast cancer,NCT00002529
Radiation Therapy Plus Topotecan in Treating Patients With Non small Cell Lung Cancer,Phase I trial to study the effectiveness of radiation therapy plus topotecan in treating       patients who have non small cell lung cancer  Drugs used in chemotherapy use different ways       to stop tumor cells from dividing so they stop growing or die  Combining chemotherapy and       radiation therapy may kill more tumor cells,NCT00002537
Screening for Prostate Cancer in Older Patients  PLCO Screening Trial,This clinical trial studies whether screening methods used to diagnose cancer of the       prostate  lung  colon  rectum  or ovaries can reduce deaths from these cancers  Screening       tests may help doctors find cancer cells early and plan better treatment for prostate       cancer,NCT00002540
Gallium Nitrate in Treating Children With Brain Tumor  Neuroblastoma  Rhabdomyosarcoma  Non Hodgkin s Lymphoma  or Refractory Solid Tumors,RATIONALE  Drugs used in chemotherapy use different ways to stop tumor cells from dividing       so they stop growing or die         PURPOSE    Phase I trial to study the effectiveness of gallium nitrate in young patients who       have malignant brain tumors  neuroblastoma  rhabdomyosarcoma  non Hodgkin s lymphoma  or       refractory solid tumor,NCT00002543
Chemotherapy Plus Radiation Therapy With or Without Surgery in Treating Patients With Stage IIIA Non small Cell Lung Cancer,RATIONALE  Drugs used in chemotherapy use different ways to stop tumor cells from dividing       so they stop growing or die  Combining radiation therapy with chemotherapy may kill more       tumor cells  It is not yet known if chemotherapy plus radiation therapy is more effective       with or without surgery for lung cancer         PURPOSE  Randomized phase III trial to compare the effectiveness of combining cisplatin        etoposide  and radiation therapy with or without surgery in treating patients who have stage       IIIA non small cell lung cancer,NCT00002550
Monoclonal Antibody Therapy Plus Sargramostin in Treating Patients With Advanced Neuroblastoma,RATIONALE  Monoclonal antibodies can locate tumor cells and either kill them or deliver       tumor killing substances to them without harming normal cells  Combining colony stimulating       factors  such as sargramostim  with monoclonal antibodies may be an effective treatment for       advanced neuroblastoma         PURPOSE  Phase II trial to study the effectiveness of monoclonal antibody 3F8 plus       sargramostim in treating patients who have advanced neuroblastoma,NCT00002560
Radiation Therapy in Treating Patients With Non small Cell Lung Cancer,RATIONALE  Radiation therapy uses high energy x rays to damage tumor cells         PURPOSE  Phase I II trial to study the effectiveness of radiation therapy in treating       patients with non small cell lung cancer that cannot be surgically removed,NCT00002577
Vinorelbine Plus Cisplatin or No Further Therapy in Treating Patients With Non small Cell Lung Cancer That Has Been Surgically Removed,RATIONALE  Drugs used in chemotherapy use different ways to stop tumor cells from dividing       so they stop growing or die  It is not yet known if combination chemotherapy is more       effective than no further treatment for non small cell lung cancer         PURPOSE  Randomized phase III trial to compare the effectiveness of vinorelbine plus       cisplatin with that of no further therapy in treating patients who have stage I or stage II       non small cell lung cancer that has been completely removed during surgery,NCT00002583
Radiation Therapy With or Without Antiandrogen Therapy in Treating Patients With Stage I or Stage II Prostate Cancer,RATIONALE  Radiation therapy uses high energy x rays to damage tumor cells  Androgens can       stimulate the growth of prostate cancer cells  Hormone therapy using flutamide  goserelin        and leuprolide may fight prostate cancer by reducing the production of androgens  It is not       yet known which regimen of antiandrogen therapy is most effective for prostate cancer         PURPOSE  Randomized phase III trial to study the effectiveness of radiation therapy with or       without antiandrogen therapy in treating patients who have stage I or stage II prostate       cancer,NCT00002597
Radiation Therapy in Treating Patients With Stage II or Stage III Prostate Cancer,RATIONALE  Radiation therapy uses high energy x rays to damage tumor cells and may be an       effective treatment for prostate cancer         PURPOSE  Phase I II trial to study the effectiveness of radiation therapy in treating       patients who have previously untreated stage II or stage III prostate cancer,NCT00002602
Chemotherapy Followed by Surgery or Radiation Therapy in Treating Patients With Stage III Non small Cell Lung Cancer,RATIONALE  Drugs used in chemotherapy use different ways to stop tumor cells from dividing       so they stop growing or die  Giving a chemotherapy drug before surgery may shrink the tumor       so that it can be removed during surgery  Radiation therapy uses high energy x rays to       damage tumor cells  It is not yet known whether chemotherapy followed by surgery with or       without radiation therapy is more effective than chemotherapy followed by radiation therapy       alone in treating non small cell lung cancer         PURPOSE  Randomized phase III trial to compare the effectiveness of chemotherapy followed by       surgery with or without radiation therapy to that of chemotherapy followed by radiation       therapy alone in treating patients who have stage III non small cell lung cancer,NCT00002623
Video Assisted Surgery Followed by Radiation Therapy in Treating Patients With Stage I Non small Cell Lung Cancer and Poor Heart and Lung Function,RATIONALE  Video assisted surgery followed by radiation therapy may be an effective       treatment in patients whose poor heart and lung function make them high risk for standard       surgery         PURPOSE  Phase II trial to study the effectiveness of video assisted surgery followed by       radiation therapy in treating patients with stage I non small cell lung cancer and poor       heart and lung function,NCT00002624
Hormone Therapy With or Without Surgery or Radiation Therapy in Treating Patients With Prostate Cancer,RATIONALE  Hormones can stimulate the growth of prostate cancer cells  Hormone therapy may       fight prostate cancer by reducing the production of androgens  Radiation therapy uses       high energy x rays to damage tumor cells  It is not yet known whether hormone therapy plus       surgery is more effective than hormone therapy plus radiation therapy for prostate cancer         PURPOSE  This randomized phase III trial is studying giving hormone therapy alone to see how       well it works compared to giving hormone therapy together with bilateral orchiectomy or       radiation therapy in treating patients with stage III or stage IV prostate cancer,NCT00002633
Chemotherapy  Radiation Therapy  Immunotherapy  and Bone Marrow Transplantation in Treating Patients With Neuroblastoma,RATIONALE  Drugs used in chemotherapy use different ways to stop tumor cells from dividing       so they stop growing or die  Combining chemotherapy with bone marrow transplantation may       allow the doctor to give higher doses of chemotherapy drugs and kill more tumor cells        Radiation therapy uses high energy x rays to damage tumor cells  Monoclonal antibodies can       locate tumor cells and either kill them or deliver tumor killing substances to them without       harming normal cells         PURPOSE  Phase II trial to study the effectiveness of combining chemotherapy  radiation       therapy  immunotherapy  and bone marrow transplantation in treating patients with       neuroblastoma,NCT00002634
Biological Therapy in Treating Patients With Prostate Cancer,RATIONALE  Interleukin 2 may stimulate a person s white blood cells including natural killer       cells to kill prostate cancer cells  Interferon gamma may interfere with the growth of the       cancer cells  Combining interferon gamma with interleukin 2 may be a more effective       treatment for prostate cancer         PURPOSE  Phase I II trial to study the effectiveness of biological therapy using       interleukin 2 and interferon gamma in treating patients with advanced prostate cancer,NCT00002637
SWOG 9416  Chemotherapy  Radiation Therapy  and Surgery in Treating Patients With Stage III Non small Cell Lung Cancer,RATIONALE  Drugs used in chemotherapy use different ways to stop tumor cells from dividing       so they stop growing or die  Radiation therapy uses high energy x rays to kill tumor cells        Combining radiation therapy with chemotherapy may kill more tumor cells         PURPOSE  Phase II trial to study the effectiveness of chemotherapy using cisplatin and       etoposide  radiation therapy  and surgery  with adjuvant therapy using cisplatin and       etoposide  in treating patients who have stage III non small cell lung cancer,NCT00002642
