Title,Abstract,NCT ID
Chemotherapy in Treating Patients With Stage IIIB or Stage IV Non small Cell Lung Cancer,RATIONALE  Drugs used in chemotherapy use different ways to stop tumor cells from dividing       so they stop growing or die  It is not yet known which regimen of chemotherapy is more       effective for non small cell lung cancer         PURPOSE  Randomized phase III trial to compare the effectiveness of two regimens of       chemotherapy in treating patients who have stage IIIB or stage IV non small cell lung       cancer,NCT00004100
Monoclonal Antibody Therapy Plus Etoposide in Treating Patients With Neuroblastoma,RATIONALE  Monoclonal antibodies can locate tumor cells and either kill them or deliver       tumor killing substances to them without harming normal cells  Drugs used in chemotherapy       use different ways to stop tumor cells from dividing so they stop growing or die  Combining       monoclonal antibody therapy with chemotherapy may kill more tumor cells         PURPOSE  Phase II trial to study the effectiveness of monoclonal antibody therapy plus       etoposide in treating patients who have neuroblastoma,NCT00004110
S9921  Hormone Therapy With or Without Mitoxantrone and Prednisone in Patients Who Have Undergone Radical Prostatectomy for Prostate Cancer,RATIONALE  Hormones can stimulate the production of prostate cancer cells  Hormone therapy       may fight prostate cancer by reducing the production of androgens  Drugs used in       chemotherapy use different ways to stop tumor cells from dividing so they stop growing or       die  It is not yet known whether hormone therapy plus mitoxantrone and prednisone is more       effective than hormone therapy alone for prostate cancer         PURPOSE  This randomized phase III trial is studying hormone therapy  mitoxantrone  and       prednisone to see how well they work compared to hormone therapy alone in treating patients       who have undergone radical prostatectomy for prostate cancer,NCT00004124
Paclitaxel and Oxaliplatin in Treating Patients With Recurrent or Advanced Non small Cell Lung Cancer,RATIONALE  Drugs used in chemotherapy use different ways to stop tumor cells from dividing       so they stop growing or die  Combining more than one drug may kill more tumor cells         PURPOSE  Phase II trial to study the effectiveness of combining paclitaxel and oxaliplatin       in treating patients who have recurrent or advanced non small cell lung cancer,NCT00004126
Positron Emission Tomography for Detecting Non small Cell Lung Cancer,RATIONALE  Imaging procedures  such as positron emission tomography  PET   may improve the       ability to detect the extent of non small cell lung cancer         PURPOSE  Diagnostic trial to study the effectiveness of PET for detecting lesions in       patients who have newly diagnosed stage I  stage II  or stage IIIA non small cell lung       cancer,NCT00004138
Gemcitabine Plus Docetaxel or Irinotecan in Treating Patients With Stage IIIB or Stage IV Non small Cell Lung Cancer,RATIONALE  Drugs used in chemotherapy use different ways to stop tumor cells from dividing       so they stop growing or die  Combining more than one drug may kill more tumor cells         PURPOSE  Phase II trial to compare the effectiveness of gemcitabine plus either docetaxel or       irinotecan in treating patients who have stage IIIB or stage IV non small cell lung cancer,NCT00004139
Arsenic Trioxide in Treating Patients With Stage IV Prostate Cancer That Has Not Responded to Previous Hormone Therapy,RATIONALE  Drugs used in chemotherapy use different ways to stop tumor cells from dividing       so they stop growing or die         PURPOSE  Phase II trial to study the effectiveness of arsenic trioxide in treating patients       who have stage IV prostate cancer that has not responded to hormone therapy,NCT00004149
Acridine Carboxamide in Treating Patients With Advanced Non small Cell Lung Cancer,RATIONALE  Drugs used in chemotherapy use different ways to stop tumor cells from dividing       so they stop growing or die         PURPOSE  Phase II trial to study the effectiveness of acridine carboxamide in treating       patients who have advanced non small cell lung cancer that cannot be treated with surgery,NCT00004151
Gemcitabine Plus Paclitaxel in Treating Patients With Advanced Non small Cell Lung Cancer or Other Solid Tumor,RATIONALE  Drugs used in chemotherapy use different ways to stop tumor cells from dividing       so they stop growing or die  Combining more than one drug may kill more tumor cells         PURPOSE  Phase I II trial to study the effectiveness of gemcitabine plus paclitaxel in       treating patients who have advanced non small cell lung cancer or other solid tumor,NCT00004159
Chemotherapy Plus Radiation Therapy in Treating Patients With Stage III Non small Cell Lung Cancer That Cannot Be Surgically Removed,RATIONALE  Drugs used in chemotherapy use different ways to stop tumor cells from dividing       so they stop growing or die  Radiation therapy uses high energy x rays to damage tumor       cells  Combining chemotherapy with radiation therapy may kill more tumor cells         PURPOSE  Phase I II trial to study the effectiveness of chemotherapy plus radiation therapy       in treating patients who have stage III non small cell lung cancer that cannot be surgically       removed,NCT00004160
Trastuzumab in Treating Patients With Advanced Salivary Gland Cancer,RATIONALE  Monoclonal antibodies  such as trastuzumab  can locate tumor cells and either       kill them or deliver tumor killing substances to them without harming normal cells         PURPOSE  Phase II trial to study the effectiveness of trastuzumab in treating patients who       have advanced salivary gland cancer,NCT00004163
Combination Chemotherapy and Peripheral Stem Cell Transplantation in Treating Patients With Neuroblastoma,RATIONALE  Drugs used in chemotherapy use different ways to stop tumor cells from dividing       so they stop growing or die  Combining chemotherapy with peripheral stem cell       transplantation may allow the doctor to give higher doses of chemotherapy drugs and kill       more tumor cells         PURPOSE  This randomized phase III trial is studying peripheral stem cell transplantation       with treated peripheral stem cells following combination chemotherapy to see how well it       works compared to peripheral stem cell transplantation with untreated peripheral stem cells       following combination chemotherapy in treating patients with neuroblastoma,NCT00004188
Prinomastat and Combination Chemotherapy in Treating Patients With Metastatic or Recurrent Non small Cell Lung Cancer,RATIONALE  Prinomastat may stop the growth of non small cell lung cancer by stopping blood       flow to the tumor  Drugs used in chemotherapy stop tumor cells from dividing so they stop       growing or die         PURPOSE  Randomized phase III trial to determine the effectiveness of prinomastat plus       cisplatin and gemcitabine in treating patients who have metastatic or recurrent non small       cell lung cancer,NCT00004199
Gemcitabine Plus Carboplatin or Cisplatin in Treating Patients With Stage IIIB  Stage IV  or Recurrent Non small Cell Lung Cancer,RATIONALE  Drugs used in chemotherapy use different ways to stop tumor cells from dividing       so they stop growing or die  Combining more than one drug may kill more tumor cells         PURPOSE  Randomized phase II trial to compare the effectiveness of gemcitabine plus       carboplatin with that of gemcitabine plus cisplatin in treating patients who have stage       IIIB  stage IV  or recurrent non small cell lung cancer,NCT00004201
Combination Chemotherapy  Radiation Therapy  and RSR13 in Treating Patients With Stage III Non small Cell Lung Cancer,RATIONALE  Drugs used in chemotherapy use different ways to stop tumor cells from dividing       so they stop growing or die  Radiation therapy uses high energy x rays to damage tumor       cells  Drugs such as RSR13 may make tumor cells more sensitive to radiation therapy         PURPOSE  Phase II trial to study the effectiveness of combination chemotherapy  radiation       therapy  and RSR13 in treating patients who have stage III non small cell lung cancer that       cannot be removed by surgery,NCT00004202
Combination Chemotherapy in Treating Patients With Stage IIIB or Stage IV Non small Cell Lung Cancer,RATIONALE  Drugs used in chemotherapy use different ways to stop tumor cells from dividing       so they stop growing or die  Combining more than one drug may kill more tumor cells  It is       not yet known whether three courses of combination chemotherapy are more effective than six       courses of combination chemotherapy for non small cell lung cancer         PURPOSE  Randomized phase III trial to compare the effectiveness of three courses of       combination chemotherapy with that of six courses of combination chemotherapy in treating       patients who have stage IIIB or stage IV non small cell lung cancer,NCT00004209
Vaccine Therapy in Treating Patients With Metastatic Prostate Cancer,RATIONALE  Vaccines may make the body build an immune response to kill tumor cells         PURPOSE  Phase I II trial to study the effectiveness of vaccine therapy in treating patients       who have metastatic prostate cancer,NCT00004211
Gene Therapy Plus Radiation Therapy in Treating Patients With Non Small Cell Lung Cancer,RATIONALE  Inserting the gene for p53 into a person s cancer cells may improve the body s       ability to fight cancer  Radiation therapy uses high energy x rays to damage tumor cells         PURPOSE  Phase I trial to study the effectiveness of gene therapy plus radiation therapy in       treating patients who have non small cell lung cancer,NCT00004225
10 Propargyl 10 Deazaaminopterin in Treating Patients With Stage IIIB or Stage IV Non small Cell Lung Cancer,RATIONALE  Drugs used in chemotherapy use different ways to stop tumor cells from dividing       so they stop growing or die         PURPOSE  Phase II trial to study the effectiveness of 10 propargyl 10 deazaaminopterin in       treating patients who have stage IIIB or stage IV non small cell lung cancer,NCT00004238
Vaccine Therapy Plus QS21 in Treating Patients With Small Cell Lung Cancer That Has Responded to Initial Therapy,RATIONALE  Vaccines may make the body build an immune response to kill tumor cells        Biological therapies  such as QS21  use different ways to stimulate the immune system and       stop cancer cells from growing         PURPOSE  Phase II trial to study the effectiveness of vaccine therapy plus QS21 in treating       patients who have small cell lung cancer that has responded to initial therapy,NCT00004249
Combination Chemotherapy and Radiation Therapy in Treating Patients With Stage II or Stage III Non small Cell Lung Cancer That Cannot Be Removed By Surgery,RATIONALE  Drugs used in chemotherapy use different ways to stop tumor cells from dividing       so they stop growing or die  Specialized radiation therapy delivers a high dose of radiation       directly to the tumor which may kill more tumor cells and cause less damage to normal       tissue         PURPOSE  Phase II trial to study the effectiveness of combination chemotherapy and       specialized high dose radiation therapy in treating patients who have stage II or stage III       non small cell lung cancer that cannot be removed by surgery,NCT00004253
Docetaxel  Cisplatin  and Amifostine in Treating Patients With Advanced Non small Cell Lung Cancer,RATIONALE  Drugs used in chemotherapy use different ways to stop tumor cells from dividing       so they stop growing or die  Chemoprotective drugs such as amifostine may protect normal       cells from the side effects of chemotherapy         PURPOSE  Phase I II trial to study the effectiveness of combining docetaxel  cisplatin  and       amifostine in treating patients who have advanced non small cell lung cancer that cannot be       surgically removed,NCT00004264
Paclitaxel in Treating Patients With Recurrent or Refractory Non small Cell Lung Cancer,RATIONALE  Drugs used in chemotherapy use different ways to stop tumor cells from dividing       so they stop growing or die         PURPOSE  Phase II trial to study the effectiveness of paclitaxel in treating patients who       have recurrent or refractory non small cell lung cancer,NCT00004265
Study of Bile Acids in Patients With Peroxisomal Disorders,OBJECTIVES  I  Determine the effectiveness of oral bile acid therapy with cholic acid        chenodeoxycholic acid  and ursodeoxycholic acid in patients with peroxisomal disorders       involving impaired primary bile acid synthesis         II  Determine whether suppression of synthesis of atypical bile acids and enrichment of bile       acid pool with this regimen is effective in treating this patient population and improving       quality of life,NCT00004442
Thalidomide for the Treatment of Hormone Dependent Prostate Cancer,This multi center study will evaluate whether thalidomide can improve the effectiveness of       the drugs leuprolide or goserelin in treating testosterone dependent prostate cancer        Leuprolide and goserelin both approved to treat prostate cancer reduce testosterone       production  which  in most patients  reduces the size of the tumor  Thalidomide  a drug used       for many years to treat leprosy  blocks the growth of blood vessels that may be important to       disease progression         Patients 18 years or older with testosterone dependent prostate cancer that has persisted or       recurred after having had surgery  radiation therapy  or cryosurgery  but whose disease has       not metastasized  spread beyond the prostate  may be eligible for this study  Candidates are       screened with a medical history and physical examination  including blood tests  bone and       computed tomography  CT  scans or other imaging studies         Study participants are randomly assigned to one of two treatment groups  One group receives       leuprolide or goserelin followed by thalidomide  the other receives leuprolide or goserelin       followed by placebo  a look alike pill with no active ingredients   Patients in both groups       receive an injection of leuprolide or goserelin once a month for 6 months  After that time       they take four capsules of either thalidomide or placebo once a day and remain on the drug       until their prostate specific antigen  PSA  level returns to what it was before beginning       leuprolide or goserelin or to 5 nanograms per liter  whichever is lower  PSA is a protein       secreted by the prostate gland  Monitoring changes in levels of this protein can help       evaluate tumor progression   At this point the entire procedure begins again  starting with       leuprolide or goserelin treatment  but the experimental drug is switched  patients       originally treated with thalidomide are crossed over to placebo  and patients originally       treated with placebo are crossed over to thalidomide         Patients are monitored periodically with the following tests and procedures         Medical histories and physical examinations  Blood and urine tests to monitor thalidomide       and PSA levels  the response to treatment  and routine laboratory values  e g   cell counts       and kidney and liver function          Computed tomography  CT  and bone scans  and possibly other imaging tests to assess the       tumor         Electromyography  EMG  and nerve conduction studies  as needed  For electromyography  a thin       needle is inserted into a few muscles and the patient is asked to relax or to contract the       muscles,NCT00004635
Low Dose Oral Methotrexate Versus Colchicine for Primary Biliary Cirrhosis,OBJECTIVES         I  Compare the efficacy of low dose oral pulse methotrexate  MTX  and ursodiol versus       colchicine and ursodiol in patients with primary biliary cirrhosis  PBC          II  Determine the optimum dose and duration of MTX treatment         III  Investigate the role of fibrogenic cytokines  FC  in PBC pathogenesis and the effect of       treatment on FC production,NCT00004748
Phase III Randomized Study of Ursodiol With Vs Without Methotrexate for Primary Biliary Cirrhosis,OBJECTIVES  I  Compare the effects of ursodiol  ursodeoxycholic acid   with and without       methotrexate  on pruritus  incapacitation index  and serum markers of activity and severity       in patients with primary biliary cirrhosis         II  Compare the effects of these regimens on the development of ascites  encephalopathy        varices  or bleeding from pre existing varices   histologic liver changes  transplantation        and survival         III  Compare the toxicity and safety of each regimen,NCT00004784
Pilot Study of Budesonide for Patients With Primary Sclerosing Cholangitis,OBJECTIVES  I  Assess the safety and effectiveness of budesonide in patients with primary       sclerosing cholangitis or primary biliary cirrhosis experiencing a suboptimal response to       ursodeoxycholic acid         II  Estimate the efficacy of this therapy in these patient groups as a means of evaluating       the feasibility of a long term randomized trial,NCT00004842
Trastuzumab in Treating Patients With Previously Treated  Locally Advanced  or Metastatic Cancer of the Urothelium,Phase II trial to study the effectiveness of trastuzumab in treating patients who have       previously treated  locally advanced  or metastatic cancer of the urothelium  Monoclonal       antibodies can locate tumor cells and either kill them or deliver tumor killing substances       to them without harming normal cells,NCT00004856
Carboplatin  Paclitaxel  and Radiation Therapy With or Without Thalidomide in Patients With Stage III Non small Cell Lung Cancer,This randomized phase III trial is studying carboplatin  paclitaxel  radiation therapy  and       thalidomide to see how well they work compared to carboplatin  paclitaxel  and radiation       therapy alone in treating patients with newly diagnosed stage III non small cell lung       cancer  Drugs used in chemotherapy use different ways to stop tumor cells from dividing so       they stop growing or die  Thalidomide may stop the growth of non small cell lung cancer by       stopping blood flow to the tumor  It is not yet known if combination chemotherapy plus       radiation therapy is more effective with or without thalidomide,NCT00004859
Monoclonal Antibody ABX EGF in Treating Patients With Renal  Kidney   Prostate  Pancreatic  Non Small Cell Lung  Colon or Rectal  Esophageal  or Gastroesophageal Junction Cancer,RATIONALE  Monoclonal antibodies such as ABX EGF can locate tumor cells and either kill them       or deliver tumor killing substances to them without harming normal cells         PURPOSE  Phase I trial to study the effectiveness of monoclonal antibody ABX EGF in treating       patients who have either renal  kidney   prostate  pancreatic  non small cell lung  colon        rectal  esophageal  or gastroesophageal junction cancer,NCT00004879
Trastuzumab in Treating Patients With Stage IIIB or Stage IV Non small Cell Lung Cancer That Overexpresses HER2,Phase II trial to study the effectiveness of trastuzumab in treating patients who have stage       IIIB or stage IV non small cell lung cancer that overexpresses HER2  Monoclonal antibodies       can locate tumor cells and either kill them or deliver tumor killing substances to them       without harming normal cells,NCT00004883
Paclitaxel and Carboplatin Chemotherapy Compared With Standard Chemotherapy in Treating Patients With Stage III or Stage IV Non small Cell Lung Cancer That Cannot Be Removed During Surgery,RATIONALE  Drugs used in chemotherapy use different ways to stop tumor cells from dividing       so they stop growing or die  It is not yet known whether paclitaxel and carboplatin is more       effective than standard chemotherapy for advanced non small cell lung cancer         PURPOSE  Randomized phase III trial to compare the effectiveness of paclitaxel and       carboplatin chemotherapy with that of standard chemotherapy in treating patients who have       stage III or stage IV non small cell lung cancer that cannot be removed during surgery,NCT00004887
Combination Chemotherapy With or Without Trastuzumab in Treating Women With Metastatic Breast Cancer,Phase II trial to study the effectiveness of combination chemotherapy with or without       trastuzumab in treating women who have metastatic breast cancer  Drugs used in chemotherapy       use different ways to stop tumor cells from dividing so they stop growing or die  Monoclonal       antibodies such as trastuzumab can locate tumor cells and either kill them or deliver       tumor killing substances to them without harming normal cells,NCT00004888
Paclitaxel and Irinotecan in Treating Patients With Advanced Non small Cell Lung Cancer,RATIONALE  Drugs used in chemotherapy use different ways to stop tumor cells from dividing       so they stop growing or die  Combining more than one drug may kill more tumor cells         PURPOSE  This phase II trial is studying how well giving paclitaxel together with irinotecan       works in treating patients with advanced non small cell lung cancer,NCT00004924
ILX23 7553 in Treating Patients With Solid Tumors That Have Not Responded to Previous Therapy,RATIONALE  ILX23 7553 may help solid tumor cells develop into normal cells         PURPOSE  Phase I trial to study the effectiveness of ILX23 7553 in treating patients who       have solid tumors that have not responded to previous therapy,NCT00004926
Calcitriol and Zoledronate in Treating Patients With Progressive Prostate Cancer,RATIONALE  Calcitriol may help prostate cancer cells develop into normal cells  Zoledronate       may delay or prevent the formation of bone metastases  Combining calcitriol and zoledronate       may be an effective treatment for progressive prostate cancer         PURPOSE  Phase I trial to study the effectiveness of combining calcitriol with zoledronate       in treating patients who have progressive prostate cancer,NCT00004928
Vaccine Therapy Plus QS21 in Treating Patients With Progressive Prostate Cancer,RATIONALE  Vaccines may make the body build an immune response to kill tumor cells         PURPOSE  Phase II trial to study the effectiveness of vaccine therapy given with QS21 in       treating patients who have progressive prostate cancer,NCT00004929
Herceptin Followed by Chemotherapy in Treating Women With Metastatic Breast Cancer That Overexpresses HER2,RATIONALE  To compare efficacy  toxicity and quality of life of the sequential       administration of Her alone followed  at PD  by the combination with Chemotherapy  Arm A        vs  the upfront combination of Her and Chemotherapy  Arm B  in patients with       advanced metastatic breast cancer         PURPOSE  Trial SAKK 22 99 addresses clinically relevant and currently unresolved questions       regarding the optimal use of Herceptin in the treatment of patients with advanced metastatic       breast cancer,NCT00004935
Topotecan and Paclitaxel in Treating Patients With Advanced Non small Cell Lung Cancer or Other Advanced Solid Tumors,RATIONALE  Drugs used in chemotherapy use different ways to stop tumor cells from dividing       so they stop growing or die  Combining more than one drug may kill more tumor cells         PURPOSE  Phase I II trial to study the effectiveness of combining topotecan and paclitaxel       in treating patients who have advanced non small cell lung cancer or other advanced solid       tumors,NCT00004979
Paclitaxel and Bryostatin 1 in Treating Patients With Metastatic Prostate Cancer,Phase II trial to study the effectiveness of combining paclitaxel and bryostatin 1 in       treating patients who have metastatic prostate cancer that has not responded to hormone       therapy  Drugs used in chemotherapy use different ways to stop tumor cells from dividing so       they stop growing or die  Combining more than one drug may kill more tumor cells,NCT00005028
Bcl 2 Antisense Oligodeoxynucleotide G3139 and Paclitaxel in Treating Patients With Recurrent Small Cell Lung Cancer,RATIONALE  Drugs used in chemotherapy use different ways to stop tumor cells from dividing       so they stop growing or die  Bcl 2 antisense oligodeoxynucleotide G3139 may increase the       effectiveness of a chemotherapy drug by making tumor cells more sensitive to the drug         PURPOSE  Phase I II trial to study the effectiveness of bcl 2 antisense oligodeoxynucleotide       G3139 and paclitaxel in treating patients who have recurrent small cell lung cancer,NCT00005032
Temozolomide in Treating Patients With Stage IIIB  Stage IV  or Recurrent Non small Cell Lung Cancer,RATIONALE  Drugs used in chemotherapy use different ways to stop tumor cells from dividing       so they stop growing or die         PURPOSE  Phase II trial to study the effectiveness of temozolomide in treating patients who       have stage IIIB  stage IV  or recurrent non small cell lung cancer,NCT00005037
Vaccine Therapy in Treating Patients With Advanced Adenocarcinoma of the Prostate  Prostate Cancer,Randomized phase II trial to determine the effectiveness of vaccine therapy in treating       patients who have advanced adenocarcinoma of the prostate  prostate cancer   Vaccines made       from a person s prostate cancer cells may make the body build an immune response to kill       tumor cells,NCT00005039
R115777 in Treating Patients With Relapsed Small Cell Lung Cancer,RATIONALE  Drugs used in chemotherapy use different ways to stop tumor cells from dividing       so they stop growing or die         PURPOSE  Phase II trial to study the effectiveness of R115777 in treating patients who have       relapsed small cell lung cancer,NCT00005041
