Title,Abstract,NCT ID
Hormone Therapy in Treating Postmenopausal Women With Receptor Positive Breast Cancer,RATIONALE  Estrogen can stimulate the growth of breast cancer cells  Hormone therapy using       tamoxifen may fight breast cancer by blocking the uptake of estrogen  Combining chemotherapy       with hormone therapy may kill more tumor cells  Chemoprevention therapy is the use of       certain drugs to try to prevent the development or recurrence of cancer  The use of       fenretinide may be an effective way to prevent the recurrence of breast cancer  It is not       yet known whether tamoxifen plus fenretinide is more effective than tamoxifen alone for       breast cancer         PURPOSE  Randomized phase III trial to compare the effectiveness of tamoxifen plus       fenretinide with tamoxifen alone in treating postmenopausal women who have stage II or stage       III breast cancer that is estrogen receptor positive and or progesterone receptor positive,NCT00002646
Hormone Therapy in Treating Men With Stage IV Prostate Cancer,RATIONALE  Testosterone can stimulate the growth of prostate cancer cells  Hormone therapy       may be effective treatment for prostate cancer  It is not yet known which regimen of hormone       therapy is most effective for stage IV prostate cancer         PURPOSE  This randomized phase III trial is studying two different regimens of hormone       therapy and comparing how well they work in treating men with stage IV prostate cancer,NCT00002651
Pyrazoloacridine in Treating Patients With Advanced Non small Cell Lung Cancer,RATIONALE  Drugs used in chemotherapy use different ways to stop tumor cells from dividing       so they stop growing or die         PURPOSE  Phase II trial to study the effectiveness of chemotherapy with pyrazoloacridine in       treating patients with stage IIIB or stage IV non small cell lung cancer,NCT00002656
Early Detection of Second Lung Cancer in Patients With Stage I Non small Cell Lung Cancer,RATIONALE  Using new methods to examine sputum samples for the presence of cancer cells may       detect lung cancer earlier         PURPOSE  Screening trial to study the effectiveness of new methods of examining sputum       samples to detect second primary lung cancer in patients with resected stage I non small       cell lung cancer,NCT00002667
Pain Control in Patients With Recurrent or Metastatic Breast or Prostate Cancer,RATIONALE  An outpatient educational and behavioral skills training program may help       patients with metastatic breast or prostate cancer live longer and more comfortably         PURPOSE  This randomized clinical trial studies whether an outpatient educational and       behavioral skills training program will improve pain control in patients who have metastatic       or recurrent breast or prostate cancer,NCT00002668
Tributyrin in Treating Patients With Refractory Prostate Cancer or Other Solid Tumors,Phase I trial to study the effectiveness of tributyrin in treating patients with refractory       stage IV prostate cancer or other solid tumors  Drugs used in chemotherapy use different       ways to stop tumor cells from dividing so they stop growing or die,NCT00002677
Radiation Therapy in Treating Patients With Stage I or Stage II Prostate Cancer,RATIONALE  Radiation therapy uses high energy x rays to damage tumor cells         PURPOSE  Randomized phase III trial to compare the effectiveness of conventional radiation       therapy with high dose radiation therapy in treating men with stage I or stage II prostate       cancer,NCT00002703
Doxorubicin Plus Estramustine in Treating Patients With Metastatic Prostate Cancer,RATIONALE  Drugs used in chemotherapy use different ways to stop tumor cells from dividing       so they stop growing or die  Combining more than one drug may kill more tumor cells         PURPOSE  Phase I trial to study the effectiveness of doxorubicin plus estramustine in       treating patients with metastatic recurrent prostate cancer that does not respond to hormone       therapy,NCT00002721
Low  Intermediate  or High Dose Suramin in Treating Patients With Hormone Refractory Prostate Cancer,Randomized phase III trial to compare the effectiveness of low  intermediate  and high dose       suramin in treating men with stage IV prostate cancer that is refractory to hormone therapy        Drugs used in chemotherapy use different ways to stop tumor cells from dividing so they stop       growing or die  It is not yet known which regimen of suramin is more effective for prostate       cancer,NCT00002723
Chemotherapy in Treating Children With Neuroblastoma,RATIONALE  Drugs used in chemotherapy use different ways to stop tumor cells from dividing       so they stop growing or die  Some tumors become resistant to chemotherapy drugs  Combining       buthionine sulfoximine with chemotherapy may reduce resistance to the drug and allow more       tumor cells to be killed         PURPOSE  Phase I trial to study the effectiveness of melphalan  buthionine sulfoximine  and       G CSF in treating children with progressive neuroblastoma that has not responded to previous       therapy,NCT00002730
Biological Therapy in Treating Patients With Metastatic Cancer,RATIONALE  Biological therapies use different ways to stimulate the immune system and stop       cancer cells from growing  Combining different types of biological therapies  including       interferon alfa  interleukin 2  and tumor infiltrating lymphocytes  may kill more cancer       cells         PURPOSE  Phase II trial to study the effectiveness of biological therapies  including       interferon alfa  interleukin 2  and tumor infiltrating lymphocytes  in treating patients       with metastatic cancer,NCT00002733
Combination Chemotherapy Plus Peripheral Stem Cell Transplantation Followed by Surgery and or Radiation Therapy in Treating Young Patients With Advanced Neuroblastoma,RATIONALE  Drugs used in chemotherapy use different ways to stop tumor cells from dividing       so they stop growing or die  Peripheral stem cell transplantation may allow doctors to give       higher doses of chemotherapy drugs and kill more tumor cells  Radiation therapy uses       high energy x rays to damage tumor cells         PURPOSE  Phase I trial to study the effectiveness of combination chemotherapy plus       peripheral stem cell transplantation followed by surgery and or radiation therapy in       treating young patients who have newly diagnosed advanced neuroblastoma,NCT00002740
Gene Therapy in Treating Children With Refractory or Recurrent Neuroblastoma,RATIONALE  Inserting the gene for interleukin 2 into a person s neuroblastoma cells may make       the body build an immune response and kill tumor cells         PURPOSE  Phase I trial to study the effectiveness of using interleukin 2 gene modified       neuroblastoma cells in treating children who have refractory or recurrent neuroblastoma,NCT00002748
Antiandrogen Withdrawal in Treating Patients With Hormone Refractory Prostate Cancer,RATIONALE  Antiandrogen withdrawal may be an effective treatment for prostate cancer         PURPOSE  Randomized phase III trial to study the effectiveness of ketoconazole and       hydrocortisone for antiandrogen withdrawal in treating men with prostate cancer that is       refractory to hormone therapy,NCT00002760
Docetaxel Plus Estramustine in Treating Patients With Metastatic Prostate Cancer,RATIONALE  Drugs used in chemotherapy use different ways to stop tumor cells from dividing       so they stop growing or die  Combining more than one drug may kill more tumor cells         PURPOSE  Phase I II trial to study the effectiveness of combining docetaxel and estramustine       in treating patients who have metastatic prostate cancer,NCT00002775
Therapy Based on Stage of Disease and Risk Assessment in Treating Children With Neuroblastoma,RATIONALE  Drugs used in chemotherapy use different ways to stop tumor cells from dividing       so they stop growing or die  Combining chemotherapy with bone marrow transplantation may       allow the doctor to give higher doses of chemotherapy drugs and kill more tumor cells        Radiation therapy uses high energy x rays to damage tumor cells  It is not yet known which       treatment regimen is most effective in treating patients with different stages of and risk       factors for neuroblastoma         PURPOSE  Phase III trial to study the effectiveness of therapy based on stage of disease and       risk assessment in treating children with neuroblastoma,NCT00002802
Combination Chemotherapy or Observation Following Surgery in Treating Infants With Neuroblastoma,RATIONALE  Sometimes neuroblastoma will regress without treatment  but sometimes additional       treatment may be necessary  Giving more than one chemotherapy drug after surgery to remove       the tumor may kill more tumor cells         PURPOSE  Phase II trial to study combination chemotherapy or observation following surgery       in treating infants with neuroblastoma,NCT00002803
Combination Chemotherapy Compared With No Treatment Following Surgery in Treating Patients With Non small Cell Lung Cancer,RATIONALE  Drugs used in chemotherapy use different ways to stop tumor cells from dividing       so they stop growing or die  It is not yet known if combination chemotherapy given after       surgery is more effective than surgery alone for non small cell lung cancer         PURPOSE  Randomized phase III trial to compare the effectiveness of combination chemotherapy       following surgery with that of surgery alone in treating patients who have stage I  stage       II  or stage IIIA non small cell lung cancer,NCT00002823
Group Therapy Compared With Educational Materials in Patients With Prostate Cancer,RATIONALE  Developing coping strategies may help improve the quality of life of patients       with prostate cancer         PURPOSE  This randomized clinical trial is comparing the effect of group therapy with       written educational materials on the quality of life of men with stage I or stage II       prostate cancer,NCT00002848
Surgery With or Without Chemotherapy in Treating Patients With Stage I Non small Cell Lung Cancer,Randomized phase III trial to compare the effectiveness of surgery with or without       combination chemotherapy in treating patients who have stage I non small cell lung cancer        Drugs used in chemotherapy use different ways to stop tumor cells from dividing so they stop       growing or die  Combining more than one drug may kill more tumor cells  It is not yet known       whether surgery is more effective with or without chemotherapy for non small cell lung       cancer,NCT00002852
Chemotherapy Plus Hormone Therapy Versus Androgen Suppression in Treating Patients With Metastatic or Unresectable Prostate Cancer,RATIONALE  Drugs used in chemotherapy use different ways to stop tumor cells from dividing       so they stop growing or die  Combining hormone therapy with chemotherapy and androgen       suppression may kill more tumor cells  It is not yet known which treatment regimen is more       effective for prostate cancer         PURPOSE  Randomized phase III trial to compare the effectiveness of chemotherapy plus       hormone therapy versus androgen suppression alone as initial therapy in patients with       prostate cancer that is metastatic or that cannot be removed surgically,NCT00002855
Radiation Therapy With or Without Bicalutamide in Treating Patients With Stage II  Stage III  or Recurrent Prostate Cancer,RATIONALE  Radiation therapy uses high energy x rays to damage tumor cells  Androgens can       stimulate the growth of prostate cancer cells  Hormone therapy using bicalutamide may fight       prostate cancer by reducing the production of androgens  It is not yet known if radiation       therapy is more effective with or without bicalutamide for prostate cancer         PURPOSE  Randomized phase III trial to compare the effectiveness of radiation therapy with       or without bicalutamide in treating patients who have stage II  stage III  or recurrent       prostate cancer and elevated PSA levels following radical prostatectomy,NCT00002874
Flutamide  Suramin  and Hydrocortisone in Treating Patients With Prostate Cancer,RATIONALE  Hormone therapy may be an effective treatment for prostate cancer         PURPOSE  Randomized phase III trial to evaluate the effectiveness of treatment with       flutamide and suramin with or without hydrocortisone in men who have metastatic or recurrent       prostate cancer,NCT00002881
Hydroxyurea Plus Combination Chemotherapy in Patients With Non small Cell Lung Cancer,RATIONALE  Drugs used in chemotherapy use different ways to stop tumor cells from dividing       so they stop growing or die  Combining more than one drug is a way to kill more tumor cells         PURPOSE  Phase I trial to study the effects of hydroxyurea plus combination chemotherapy in       patients with non small cell lung cancer,NCT00002887
Radiation Therapy With Androgen Suppression in Treating Patients With Prostate Cancer,RATIONALE  Imaging procedures such as MRI may improve the ability to determine the response       of prostate tumors to therapy         PURPOSE  Phase II trial to study MRI results in patients with prostate cancer that has been       treated with radiation therapy plus androgen suppression therapy,NCT00002889
Marimastat in Treating Patients With Stage III Non small Cell Lung Cancer,RATIONALE  Marimastat may stop the growth of non small cell lung cancer by stopping blood       flow to the tumor         PURPOSE  Randomized double blinded phase III trial to determine the effectiveness of       marimastat in treating patients who have residual stage III non small cell lung cancer,NCT00002911
Gene Mutations in Patients With Advanced Prostate Cancer That Is Not Responsive to Hormone Therapy,RATIONALE  Gene mutations may make prostate cancer cells unable to attach to androgens  This       may permit the growth of prostate cancer  Gene testing may improve the identification of       patients with advanced prostate cancer         PURPOSE  Clinical trial to study the androgen receptor gene in patients with prostate cancer       that is not responsive to hormone therapy,NCT00002924
Surgery in Treating Patients With Prostate Cancer,RATIONALE  Prostatectomy may be an effective treatment for prostate cancer that has not       responded to radiation therapy         PURPOSE  This phase II trial is studying how well prostatectomy works in treating patients       with recurrent or persistent prostate cancer that has not responded to radiation therapy,NCT00002938
S9714  Paclitaxel in Treating Patients With Stage IIIB or Stage IV Non small Cell Lung Cancer,RATIONALE  Drugs used in chemotherapy use different ways to stop tumor cells from dividing       so they stop growing or die         PURPOSE  Phase II trial to study the effectiveness of chemotherapy with paclitaxel in       treating patients with stage IIIB or stage IV non small cell lung cancer,NCT00002969
PET Scan in Treating Patients With Metastatic Prostate Cancer,RATIONALE  New imaging procedures  such as PET scan  may improve the ability to detect new       or recurrent prostate cancer,NCT00002981
HER 2 Neu Vaccine Plus GM CSF in Treating Patients With Stage III or Stage IV Breast  Ovarian  or Non small Cell Lung Cancer,RATIONALE  Vaccines made from the HER2 neu antigen may make the body build an immune       response and kill tumor cells  Colony stimulating factors such as GM CSF increase the number       of immune cells found in bone marrow or peripheral blood         PURPOSE  Phase I trial to study the effectiveness of HER 2 neu vaccine plus GM CSF in       treating patients who have stage III or stage IV breast cancer  stage III or stage IV       ovarian cancer  or stage III or stage IV non small cell lung cancer,NCT00003002
Detection of Early Metastases in Patients With Stage I Non small Cell Lung Cancer,RATIONALE  Detecting very early metastases in bone marrow and or lymph nodes may help       doctors plan better treatment for non small cell lung cancer         PURPOSE  Clinical trial to detect the presence of metastatic cancer in patients with stage I       non small cell lung cancer that has not been previously treated,NCT00003006
Hormone Therapy in Treating Patients With Advanced Prostate Cancer,RATIONALE  Androgens can stimulate the growth of prostate cancer cells  Hormone therapy       using triptorelin may fight prostate cancer by reducing the production of androgens         PURPOSE  Randomized phase III trial to compare the effectiveness of long term hormone       therapy and triptorelin with no further treatment in treating patients who have advanced       prostate cancer previously treated with radiation therapy and 6 months of androgen       suppression,NCT00003026
Combination Chemotherapy as Induction Therapy in Treating Patients With Stage III Non small Cell Lung Cancer,RATIONALE  Drugs used in chemotherapy use different ways to stop tumor cells from dividing       so they stop growing or die  Combining more than one drug may kill more tumor cells         PURPOSE  Phase I II trial to study the effectiveness of combination chemotherapy with       docetaxel  gemcitabine  and cisplatin as induction therapy in treating patients with stage       III non small cell lung cancer,NCT00003037
Hyperthermia Plus Radiation Therapy in Treating Patients With Nonmetastatic Advanced Prostate Cancer,Hyperthermia therapy may kill prostate cancer cells by heating them to several degrees above       body temperature  Radiation therapy uses high energy x rays to damage tumor cells  Combining       hyperthermia with radiation therapy may kill more tumor cells         The purpose of this study is to determine the ability of hyperthermia when combined with       radiation therapy and in some patients hormonal therapy to control prostate cancer,NCT00003045
Combination Chemotherapy in Treating Patients With Stage I  II  or IIIA Non small Cell Lung Cancer That Has Been Surgically Removed,RATIONALE  Drugs used in chemotherapy use different ways to stop tumor cells from dividing       so they stop growing or die  Combining more than one drug may kill more tumor cells         PURPOSE  Randomized phase III trial to compare cisplatin and etoposide with no chemotherapy       in treating patients who have stage I  stage II  or stage IIIA non small cell lung cancer       that has been surgically removed,NCT00003053
Temozolomide in Patients With Progressive or Recurrent Non small Cell Lung Cancer,RATIONALE  Drugs used in chemotherapy use different ways to stop tumor cells from dividing       so they stop growing or die         PURPOSE  Phase II trial to study the effect of temozolomide in patients with progressive or       recurrent stage IV non small cell lung cancer  with or without brain metastases  who have       not been treated for metastatic disease with chemotherapy,NCT00003062
Combination Chemotherapy in Treating Patients With Metastatic Ovarian Cancer or Non small Cell Lung Cancer,RATIONALE  Drugs used in chemotherapy use different ways to stop tumor cells from dividing       so they stop growing or die  Combining more than one drug and giving the drugs in different       combinations may kill more tumor cells         PURPOSE  Randomized phase II double blinded trial to study the effectiveness of paclitaxel       and carboplatin given with either amifostine or placebo in patients with metastatic stage       III or stage IV ovarian cancer or metastatic stage III or stage IV non small cell lung       cancer,NCT00003072
Combination Chemotherapy With Ketoconazole in Treating Patients With Prostate Cancer,RATIONALE  Drugs used in chemotherapy use different ways to stop tumor cells from dividing       so they stop growing or die  Combining more than one drug may kill more tumor cells         PURPOSE  Randomized phase II trial to study the effectiveness of combination chemotherapy       consisting of paclitaxel  etoposide  and estramustine as compared with ketoconazole plus       doxorubicin  vinblastine  and estramustine in treating patients with prostate cancer,NCT00003084
Chemotherapy  Amifostine  and Radiation Therapy in Treating Patients With Non small Cell Lung Cancer,RATIONALE  Drugs used in chemotherapy use different ways to stop tumor cells from dividing       so they stop growing or die  Chemoprotective drugs  such as amifostine  may protect normal       cells from the side effects of chemotherapy  Radiation therapy uses high energy x rays to       damage tumor cells         PURPOSE  Phase II trial to study the effectiveness of paclitaxel  carboplatin  amifostine        and radiation therapy in treating patients who have unresectable locally advanced or       partially resected non small cell lung cancer,NCT00003089
Biological Therapy in Previously Treated Patients With Non small Cell Lung Cancer,RATIONALE  Interleukin 2 may stimulate a person s white blood cells to kill non small cell       lung cancer cells         PURPOSE  Phase II trial to study the effect of biological therapy with interleukin 2 in       patients with previously treated non small cell lung cancer,NCT00003090
Combination Chemotherapy in Treating Children With Neuroblastoma,RATIONALE  Drugs used in chemotherapy use different ways to stop tumor cells from dividing       so they stop growing or die  Combining more than one drug may kill more tumor cells        Combination chemotherapy plus surgery may be an effective treatment for neuroblastoma         PURPOSE  This phase III trial is studying how well combination chemotherapy followed by       surgery works in treating young patients with neuroblastoma,NCT00003093
Computer Planned Radiation Therapy in Treating Patients With Prostate Cancer,RATIONALE  Radiation therapy uses high energy x rays to kill tumor cells  Computer systems       that allow doctors to create a 3 dimensional picture of the tumor in order to plan treatment       may result in more effective radiation therapy         PURPOSE  This phase II trial is studying how well radiation therapy that has been planned       with a computer works in treating patients with prostate cancer,NCT00003104
Combination Chemotherapy Followed by Surgery in Treating Patients With Stage IIIA Non small Cell Lung Cancer,RATIONALE  Drugs used in chemotherapy use different ways to stop tumor cells from dividing       so they stop growing or die  Combining more than one drug may kill more tumor cells         PURPOSE  Phase II trial to study the effectiveness of combination chemotherapy with       irinotecan and cisplatin followed by surgery in treating patients with stage IIIA non small       cell lung cancer,NCT00003111
Epidural Hydromorphone Compared With Hydromorphone Infusion in Treating Patients With Prostate Cancer Undergoing Radical Prostatectomy,RATIONALE  Giving hydromorphone in different ways may relieve the pain associated with       cancer surgery         PURPOSE  Randomized double blinded phase III trial to compare the effectiveness of epidural       hydromorphone with hydromorphone infusion in patients with prostate cancer undergoing       radical prostatectomy,NCT00003115
Paclitaxel With or Without Carboplatin in Treating Patients With Advanced Non small Cell Lung Cancer,RATIONALE  Drugs used in chemotherapy use different ways to stop tumor cells from dividing       so they stop growing or die  Combining more than one drug may kill more tumor cells         PURPOSE  Randomized phase III trial to compare the effectiveness of paclitaxel with or       without carboplatin in treating patients who have recurrent  stage IIIB  or stage IV       non small cell lung cancer,NCT00003117
Surgery in Treating Children With Neuroblastoma,RATIONALE  Surgery alone may be effective in treating children with neuroblastoma         PURPOSE  Phase III trial to study the effectiveness of surgery alone in treating children       who have neuroblastoma,NCT00003119
Surgery in Treating Patients With Neuroblastoma,RATIONALE  Surgery may be an effective treatment for neuroblastoma         PURPOSE  This phase II trial is studying how well surgery works in treating patients with       neuroblastoma,NCT00003122
Hormone Therapy Plus Radiation Therapy in Treating Patients With Prostate Cancer,RATIONALE  Androgens can stimulate the growth of prostate cancer cells  Hormone therapy       using leuprolide and flutamide may fight prostate cancer by reducing the production of       androgens  Combining radiation therapy with hormone therapy may kill more tumor cells         PURPOSE  Phase II trial to study the effectiveness of hormone therapy plus radiation therapy       in treating patients with prostate cancer,NCT00003124
Gene Therapy in Treating Patients With Cancer of The Liver,Phase I trial to study the effectiveness of gene therapy with the p53 gene in treating       patients who have cancer of the liver that cannot be surgically removed  Inserting the p53       gene into a person s tumor may improve the body s ability to fight liver cancer,NCT00003147
Chemotherapy in Treating Patients With Advanced Non small Cell Lung Cancer,RATIONALE  Drugs used in chemotherapy use different ways to stop tumor cells from dividing       so they stop growing or die         PURPOSE  Phase II trial to study the effectiveness of aminocamptothecin in treating patients       with stage III or stage IV non small cell lung cancer,NCT00003154
